<?xml version="1.0" encoding="UTF-8"?>
<!DOCTYPE futbol SYSTEM "C:\IFCD0210\MF0491_3 Cliente\UF1841\E2\prueba dtd.dtd">
<futbol>
	<nombre>Levante Unión Deportiva</nombre>
	<ciudad>Valencia</ciudad>
	<año>1909</año>
	<entrenador>Paco López</entrenador>
	<presidente>Francisco Catalán</presidente>
	<jugadores>
		<jugador posicion="portero">
			<nombre>Javier Jiménez</nombre>
			<nacionalidad>española</nacionalidad>
		</jugador>
		<jugador posicion="delantero">
			<nombre>Nong</nombre>
			<nacionalidad>camerunés</nacionalidad>
		</jugador>
		<jugador posicion="centrocampista">
			<nombre>Jose Luis Morales</nombre>
			<nacionalidad>Española</nacionalidad>
		</jugador>
	</jugadores>
</futbol>
